如何管理迟到、不守时的学生？,"这里有一些比较有创意的方法可以预防关于守时的问题，可以再加上一个完整的、循序渐进的计划来处理迟到的学生。1．明确的规定和后果惩罚。学生上课迟到是一个常见的问题，尤其是伴随他们年龄的增长，但你可以通过明确的、统一的规定来防止这种情况的发生。要让学生们知道，如果他们迟到了，会有什么后果，不管他们找什么借口，你都会执行。后果处理可以用一种梯级模式一一一从两分钟跟进（后文将介绍）到放学后留校补齐缺勤的时间，对于情况严重的学生在放学后和他们的父母联系，或者可以用幽默的方式处理，比如邀请上课铃响了还没有在座位上的人去讲台前唱一首歌。一位喜欢使用幽默的同事曾经告诉我：“有时会有两个学生迟到，所以我们会有二重唱，偶尔甚至有唱诗班。这可以让我们每个人都面带微笑，以一种积极的方式开始上课。令人惊讶的是，在我开始使用这个策略后，准时到课就不是个问题了。""2，奖励那些准时的学生。无论学生能力如何，有一个好的出勤率是每个学生都能做到的，应该像其他社交技能一样得到认可。这种认可可以采取口头或书面表扬的形式，也可以是一个特殊的奖励或更多正式的奖励，如自由活动时间。向学生们解释，你会每天给他们3分钟自由时间。他们每天都可以利用这个时间，或者积存起来，用来做一些特别的事情。批准一些事情，让学生是可以在这个自由时间做的，比如看视频、玩游戏或者爆米花派对。对于一件特别的事情他们应该要积存多少时间，你要告诉学生。一旦他们储存了足够的时间，他们就能开展这项特别的活动。他们在使用这些时间的时候，要用秒表来计时他们所用时长，并从这3分钟里扣除。在这个问题上，群体间的竞争也是一个很好的激励因素。3．制造惊喜'每天随机选择一个学生的课桌或椅子，并在其下面放一张贴纸或纸条，这样可以鼓励学生准时到课和达到好的出勤率。准时赴课的学生在他或她的座位下面找到标签，就可以选择一个小奖品。如果学生缺席或迟到，奖品就会被没收或取消（或者可能是“用牙刷清洁厕所""）。用循序渐进的课堂管理方案来处理迟到的学生，尽量少关注迟到的学生。要平静地、气定神闲地询问他们的．名字（假设你还不知道），确认他们迟到了：“约翰，你迟到了10分钟……”直接要学生坐到座位上。让他们迅速坐下来，并给他们一些事做。你在专注于其他学生的时候，他们可以观看当下的板书等，或完成任务表，亦或进行写作任务。在这个阶段不要问他们为什么会迟到，因为这会对课程进度造成干扰，把注意力转移到别的地方在课后“两分钟跟进""时间里他们会有机会说明原因“请坐好，完成× ×任务，这节课后请你解释一下为什么迟到了'表扬在认真学习的人。表扬那些正在认真学习的学生可以转移关注迟到学生的注意力“你们俩做得很好，很高兴看到你们继续这样做其他学生都安静后，单独处理迟到的学生。一旦大多数生开始学习，那下一步就是让迟到的人投入到功课上。可以把他们集中在一组，也可以再次给他们做完整的课堂演示/课程介绍，或者更好的办法是把这些学生和其他可以教授或者解释学习任务的同学分在一组在课程结束后，跟迟到的学生联系。按时上课的学生，如果可行的话，可以稍微提前一点下课，这样你有两分钟的时间跟进迟到的学生。保持全面的记录一一“两分钟跟进""。让迟到的学生填写一张表格，说明迟到的原因以及他们到达的时间。我称这个做法为“两分钟跟进""，实践运用中，很有效果。如果学生继续迟到的话，就把迟到的后果复印一份寄回家。如果学生缺席。任务表已分发时，就将复印件放在文件夹中，以备缺勤学生使用。在一天结束的时候，简单地给每个文件夹贴上学生的名字，这样他们回来后就可以完成了。"
如何管理说脏话的学生？,"孩子们需要非常清楚他们使用不良语言的后果。如果学校没有这方面的规定，那就用自己规定的，坚持下去。这样，他们最终会明白，他们无法逃避惩罚。经常用来保持冷静的方法同样适用于此。不管他们说的话有多么的冒犯（你不需要我告诉你，他们多么有创造力），尽量不要发脾气。让你制定的行为对应后果来解决这件事。心平气和地跟学生们说，“给我一分钟""（或者无论你对这种情形有什么惩罚），把所说的记下来，然后继续上课。当你这样做时，不要提高你的声音，因为这正是他们想要触发的情绪反应。如果咒骂是一种经常发生的事清，那就从比较轻微的后果惩罚开始。那些话听起来可能像一些胡言乱语，你不能对每一种过错都做出最严重的惩罚一一如果你从“好的，你被留校了！""开始，那就限制了接下来的后果处理。（同时也有可能让整个班级留堂！）有一次，我在一个寄宿EBD里得到一份工作，一些职员辱骂 Y10和Y 1 1团体的放纵态度让我感到震惊。在此之前，我曾在非常严格的EBD环境中工作过，我决定，尽管大多数人对说脏话持放纵态度，但我不这样做。我花了几个星期的时间来处理，最终我的课上没有人说脏话。我就是这样做的：处理过程一视同仁（确保每一句辱骂性语言都得到了处理），并花时间和班上男孩建立牢固的关系。课后我花时间和他们在一起踢足球，在休息时间玩其他游戏，在午餐时间或者放学后在作业上给予帮助，在晚上出去走走等等。我知道你在想什么，是的，这将给我增添很多额外工作。但结果证明这是有用的。这意味着我只需要说“喂，停止说这样的话""，他们就会遵守——会尊重我，因为学生知道我关心他们。最终，这不再是一个问题了一一一这些孩子的态度曾是最粗暴的！处理辱骂的其他办法：1．举办一个讨论会。给学生一个机会，来讨论说脏话这个问题，并要求他们设定自己的基本规则。让学生讨论他们能接受或不能接受什么，以及他们会对“说脏话者""做些什么。与学生讨论如何表达尊重。你说话的方式如何传达尊重、不尊重、关心或蔑视等等？我们使用粗话时，它传达了什么信息？我们该如何说话，为什么这样说？如果我们在公共场合使用粗俗的语言，我们会给别人留下什么样的印象呢，比如在餐馆和我们的女朋友/男朋友在一起？这就是我们想要的吗？被别人否定的好处/坏处是什么？2，拒绝卷入。学生们会说“哦，我们一直这样说。'' “我妈妈和爸爸都这么说。”你的反应：“也许是这样，但我们在这门课上不能这样说话。我不跟你说这些话。那我也不希望你们在教室里说。好吗？谢谢你。”3．不要太在意。这个学生可能是想引起别人的反应。不要表现出你的厌恶，首先以其他的学生为中心，冷静地把他这件事放在一边，在私下处理。4，设置一个“脏话盒”。你不能拿他们的钱，但是你可以通过剥夺他们的好处、休息时间、电脑使用权利等来惩罚他们。每说一句脏话，就要放一个硬币在“脏话盒""里。当达到预先设定的限值时，惩罚就会生效。5，来自父母的支持。试着鼓励父母/监护人在家坚持鼓励学生使用礼貌性语言、批评学生讲脏话。因此你可以认为《黑道家族》可能不是他们应该看的那种家庭剧，但或许最好解释一下，不恰当的语言事件是一个问题，如果不加以制止，对学生的未来来说，这将是一个更大的问题。"
如何让学生听从你的指示？,"你是否曾要求学生们开始写作业，在四处走动5分钟后，却发现他们完全无视你的话？（如果你说没有，我不太相信！）随后，当你问学生为什么不做，他们只是说“我没听到你说""或者“我不知道你是什么意思""。这是一个非常有效的借口，因为他们直接把责任推给了老师。毕竟，如果他们没有听到你说的或者不理解，那只能是你的错，因为你说的不够清楚。在这种情况下，你唯一能做的就是假定他们是无辜的或者给他们第二次机会。就像我说的，这是一个有效的借口，因为它貌似合理地给了他们大量的时间逃避作业。学生找借口而不是照你说的做是因为他们能找到借口。如果你说的不清楚，就给了他们理由去争辩、抱怨，而不是按你的要求去做。不过别担心，我有一些巧妙的办法供你在这些情况下使用。1．在给出指示前要确保学生全神贯注。确保学生是在看着你，而不是在玩笔或转到另一边、顶着一本书等等。一个很巧妙的眼神交流办法就是把笔举在你的面前，然后在你的面前慢慢移动。这支笔会吸引学生的目光，然后他们的视线会跟着这笔，直到学生和你眼神对视。就像魔法一样！2．保持一致性。一致性就是确保我们的面部表情、肢体语言、声调、音高和音量所传达的无声信息与我们实际使用的词语是相一致的。当保持一致时，各个方面的沟通都是同步的。简而言之，把我们要说的表达清楚。在我们开始说话之前，学生会观察我们的手势，以及我们说话的方式。如果这些关键方面我们出现任何错误，在我们开口之前，学生就会决定是听我们的，还是无视我们的话，抑或反击。我们无意识传达的无声信息往往是决定学生行为的根源。你是否在学生面前表现出太累了？如果有的话，他们很有可能会忽视我们。如果还要求学生做一些他们不愿做的事情，他们就会努力把我们逼疯。你是否在学生面前表现出愤怒？如果这样的话，他们很可能彻底反抗。强硬的学生还可能会进行报复，而那些胆小的学生可能会怀恨在心，在以后的日子里再寻求报复。无论哪种情况，他们都不太可能表现出我们希望的那样，最后的结果，充其量是他们会勉强服从。我们说话的方式对学生的反应有很大的影响。我们留给他们的印象可以是容易被击败的人，也可以是对他们的威胁或者一个领导者，这都取决于我们发出的无声信息。要有自信的肢体语言，在课堂上要有一席之地，要有开放的姿态，冷静、慎重地说话，避免皱眉或指指点点。3．确保你说的清晰明了。学生需要明确地知道你想让他们做什么。“约翰，你别再敲你的钢笔了，别在椅子上晃来晃去。""这样说会比下面的说法更能达到期望的结果：“约翰，停下来！”这会让他们有疑问…… “停下来什么，老师？一一然后在知道停下来什么之前，就陷人了一场争论。含糊的术语，比如“安静""、“适当""、“明智""和“尊重""等，这些在教室里都会引起问题。他们会直接和你对抗…… “请安静地写作业！”对于有些学生来说，“安静""的意思是“窃窃私语""，而对另一些学生来说，是用平常的音量来说话。有些学生可能会认为这意味着噪音水平根本没有真正的衡量标准。而你的意思可能是“默默地写作业！'在一些情况下，学生会因为在椅子上发出太多噪音或摇晃受到批评，却几乎可以肯定地说他们是在“安静地学习""或“正确地坐着""。这也并不奇怪，像这样含糊的指令没有带来我们想看到的行为，而且常常会是争论的根源。不管在哪里，模糊的指令都有可能导致学生违反规定。为了让学生保持在适当的噪音水平之内或正确的坐姿，我们需要明确我们所说的“安静""或“正确""的意思。年幼的孩子可能需要一个具体的表达方式一一一可以用一把尺子做演示，告诉学生用 “ 30厘米的声音""或用和伙伴说话的音量说话，而不是用“码的声音""（码是用来测量大的具体的东西，不用于纸张测量）。对于年纪较大的学生，我们可以通过展示我们所提到的音量来简单地说明。为了让学生停止在椅子上晃悠，需要更明确的指令：“约翰，像其他人一样坐在你的椅子上，椅子四条腿都要平放在地板上。”这听起来虽然很学究，但避免了“我正确地坐着""的争论。4．微笑。这会让反抗你权威的学生容易接受你的指令，也表明了你的自信。5，要求学生确认已经明白你的意思。这是关键的一步，因为一旦学生告诉你他们明白了，就再也不能用“我不明白""或“我没听到""来搪塞你。 “戴伦，我刚才叫你做什么？ “凯尔，告诉我，我刚才说了什么。“约翰，请重复一下我说的，我知道你听到了"" 其他课堂管理策略也可以让学生听你的话：（1）给学生一个理由。1978年，一组研究人类行为的心理学家试图探索让人们更倾向于为他人提供帮助的因素。实验为让人们共用一台复印机，实验中使用了三种方法请求插队：只是提出请求：“打扰一下，你介意我在你前面用复印机吗？"" 编造理由或不相关的理由：“打扰一下，你介意我在你前面用复印机吗？因为我要复印一些东西。""真正的原因：“对不起，你介意我在你前面用复印机吗？因为我很着急！'因此，三分之一的时间他们只是要求插队，三分之一的时间他们给出了一个不相关的理由（他们当然是要用这台复印机的！），分之一的时间他们实际上给出了一个很好的理由（“我在赶时问""）。这项研究产生了有趣的结果。当研究人员给出一个想要插队的理由时，他们被允许做的事情比只是简单地请求却没有给出原因要多。这项研究中最令人惊讶的是，这件事似乎与原因无关一一完全不相干的原因，比如“我能先用吗？我真的很喜欢2012年奥运会的标志""，这个原因也是可以的。这项研究结果和我们课堂管理策略有联系的是，我们要求学生做一些事情的时候，我们应该给出做这些事情的理由：“你这样做能一．这就是为什么要做这件事""。并不一定是一个很好的理由。毫无疑问，“继续写你的作业，否则你做不完了""和“继续写你的作业，否则你不得不在休息时间完成""将会引发更少的争论和抗议。“帮帮我，消停一下吧，我宿醉头痛了。""一一而不是严厉地说 “安静点！“请排队，因为我们快没时间了。""一一而不是“请排队。"" 给出让学生做这些事的理由意味着你重视这些事情，并且不会让他们认为你是个滥用权威或者专制的人。“可以在12：30午餐时间来这里找我，这样我们不会过多占用 ""一一而不是“在午餐时间来找我，别你的午餐时间就能解决问题。忘了'跟他们开开玩笑。看看会发生什么……但不要得意忘形，否则你可能会惹上麻烦（“把你的晚餐钱给我，因为我的工资很低""，这几乎肯定会让你在圈子里不受欢迎）。（2）亲切地请求。在要求学生做你说的事情之前，要先说声 “谢谢”再来提出这个要求，让学生清楚地知道我们希望他们给予的是积极的回应。我们都知道积极期望的影响和作用，因此，用这种方式表达的要求会产生有利的结果，对学生也有相当神奇的效果。“	谢谢你，马上排队""有时人们不会注意他们所接收的信息，除了一些短语、句子。如果把你的要求放人一个人们习惯遵守的语言结构中，这会是让学生遵照你说的做的好机会。通过一一对学生给予表扬，学生可以很愉快地听你的话。“谢谢你照我的要求做一一这让我的工作轻松多了。"""
如何处理学生愚蠢的行为？,"接下来的课堂管理策略是用来应对愚蠢的学生一一一比如，那些用不成熟、寻求注意力的行为来扰乱课堂秩序的学生。我发现，那些需要“炫耀""、渴望得到关注的学生，能从我给的做事机会中获益一一一尽管是以一种可控的方式。请理解，这种课堂管理策略不是宽恕或鼓励学生不当地吸引注意力，但如果一个孩子有很强的幽默感，应该（明智地）鼓励，只要你能够做到且不失去你的控制，并且不会造成“什么都行""的混乱气氛。可以考虑以下两种不同的方法：例1：老师：“乔尼，我受够了你的胡闹！如果你继续这样，就会被留校。”（乔尼表现得像个白痴，以获得同伴的认可。）老师：“	 乔尼，那就这样吧，我警告过你，你被留校了。""例2：在上课前，老师把乔尼叫出去。老师：“嘿，乔尼，我能跟你说句话吗？听着，你有不可思议的天赋。你知道是什么吗？”学生：“呃，．老师：“你有让人笑的天赋一一一你很幸运。这是一项很有价值的技能，会让你很受欢迎。但我们遇到了一些问题。在课堂进行中或者在我试图让班上的同学学习时，你引人发笑的行为会分散每个人的注意力，因为他们都克制不住地在笑，对吗？""（老师微笑着说。）学生：“呃，是的。”老师： 所以这样做，怎么样？“	一一一我会给你些时间进行喜剧和歌舞表演，但其余的时间你都要保持安静。这对你来说可以吗？”学生： “什么意思？"" 老师：“课堂的某个时候我会给你5分钟，在课堂开始、结束、中间某个时刻或者我们需要休息的时候，你可以给我们讲一些你的笑话。但是有几个规定：笑话须是健康的、非种族主义的。当我给你一个开始信号的时候你就可以开始了；当我给你停止信号的时候你必须停下来。如果你不能遵守的话，那你就得留校，我想我们俩都不会愿意，对吗？""希望你能从这两个例子中看到，在处理难管教和寻求注意的孩子时，老师的态度是至关重要的，可以使一个小问题变得更糟．一一但也可以变成一个学习的机会。"
如何让过分活泼的学生对课堂感兴趣？我给学生的特别多的任务，他们好像变笨了。,"茱莉亚，汤普森：首先，班上有非常活跃的学生的话，我们就会面临纪律管理问题，你需要做的是教孩子怎么样进行娱乐活动，怎么安静地开展活动。在正式开始前，你、须带着学生练习一下所以如果在活动中遇到了麻烦，那么你需要有办法应对。做一些简短的游戏，这样学生不至于太闹腾。只是玩几个简短的游戏，他们就没有时间胡闹，这样在对学生提出要求的时候，他们就能保持安静和理智。有时老师管理一大群学生会比较困难一一所以让学生分组在一起玩，他们可以做各种各样的小活动，这回顾起来应该很有趣，但是有时分组进行活动的学生也很闹腾，以至于局面可能无法控制一一我永远不会允许超过3个学生一起活动。有时分组开展活动的学生往往相处得很好，会让孩子们变得有兴趣一一一如果学生很活跃并且很吵的话，就要教他们如何控制自己的声音，还要确保学生活动是以小组为单位。另外，如果想让学生对课堂感兴趣，你可以使用现代技术，有成千上万的在线图片可以用来玩游戏，我推荐一个几乎所有人都能够使用的网站www.freerice.com/这是个不错的网站，让学生们接触数小时就会爱上它。研究生、陌生人和英语专业学习者都可以使用它，在单词表中选词。例如，有四个答案时，如果你选中了正确的答案，就会有10 粒大米捐赠给世界粮食计划署，由其援助给贫困地区的学生。这些学生非常贫穷，无论你在哪里玩这个游戏，都是做好事。所以我们让学生投人到游戏中，他们就会很繁忙并且都会很活跃。学生能够为别人做一些事情，也能让他们表现出最好的一面。罗博·普莱文：好的，我和你们分享一个与这个相关的小故事。我上科学课的学生（14岁）被老师禁止进行实践操作。一次偶然的机会，我不知道发生了这件事，我说“我们今天要用化学药品""，他们说“不，不，不，我们不做实验，我们不准用这些设备！""我简直不敢相信一一一老师因为他们太闹腾了，所以决定不允许他们进行实践性活动，他们只允许做每课任务表后面的活动。我的意思是，我能理解不允许学生在一两天内做实践活动，这是因为上一节课他们表现不佳。但是永远禁止他们，这就有点疯狂了！难怪这些学生被认为是坏家伙并且无聊得要死！“听着，我认为我们应该重新开始，我相信你们在使用这些设备的时候能对自己的行为负责并且还会开展讨论。他们脸上的表情就像是一幅画。他们无法相信这是真的，但我补充说：“有一个附带条件一一""我非常仔细地解释了如果他们不能兑现承诺的话，会有什么后果。我说，“我们要先试10分钟，如果你们表现的不错，我们就继续。你们要向我证明你们是值得信任的。这样听起来公平吗？”学生会努力表现，而且非常感激你给他们这样一个机会。在那之后，他们是我最喜欢的集体之一。我们玩得很开心。我认为把事情分成小块来做，有时是可行的，有些孩子就是无法处理大事情，需要分成小部分完成，且需要不断地给他们提醒。你需要非常清楚地向学生解释，如果破坏约定，会有什么后果一一如果这不起作用，他们会变得更闹腾。很显然，为此你需要准备好一些备用的办法，以应对这种情况。基本上，就如何处理这个问题我做了一些准备。从一个小的处罚开始，给学生机会，让他们知道你信任他们一一一所以刚开始也许只是和他们谈话，跟他们说：“看，事情进展不理想，但是我想让你们玩得开心，所以我们要重新开始，这就是方法，我们从小的活动开始，看看是否能以此为基础顺利推进。"""
如何管理课堂上喜欢开玩笑捣乱的学生？,"这些爱开玩笑的学生急切地想引起别人的注意。他们说出的妙语、粗鲁的评论、下流的手势、机智的反驳和俏皮的话语可能很有趣（不幸的是，有些班上搞笑的学生确实是这样！）。这些学生使用了障眼法，掩盖了他们的挫折、失望、自卑和无法融人班级。我这里有一些建议：1，确保学生知道问题的严重程度。通常这些孩子没有意识到他所造成的问题，他觉得一切都很好，因为他把别人逗乐了。你要跟学生私下里解释，他实际上惹恼了班上大多数同学，这对他有很大的影响一一因为这与他想要的效果正好相反。嘱咐他这样做会导致其他同学对他有偏见，而你不想看到这种情况发生。告诉他你会实施一套后果处理办法，其唯一的目的就是帮助他改掉这些不好的习惯。2．给学生解释清楚事情后果。让学生知道如果他继续扰乱课堂会有什么后果。一定要告诉他这并非故意针对他，这是你唯一能帮助他知道如何在课堂上表现更好的方法。3．在惩戒他们的时候尽量不要表现出任何情感。因为学生对注意力的极度渴望，你最不想做的事情就是大发雷霆，不管学生违规多少次。学生行为不当时，你要冷静地解决问题。不要小题大做，也不要对他的抗议做出让步一一通过下面的方法可以让学生没有那么闹腾。“我已经告诉过你，如果你继续的话会有什么后果，你已经做出了你的选择。如果你想更多地讨论这个问题，我们可以稍后再继续，放学后来找我，我会在办公室等你。现在继续你的学习。”一一一然后转过身，踩着你的高跟鞋走开，放学后履行约定，或者回到讲台边。4．积极的反馈。这个学生非常渴望得到关注，所以你要做好准备，当他表现不错的时候，要给予一些关注。赞扬是一种非常有效的管理策略，学生在安静地进行自己的学习任务时，你应该尽可能给予他们表扬一一一可以扔五彩纸屑，带上铜管乐队，跳上桌子，高 兴地欢呼一一但要在学生当之无愧的时候。对于不当的行为，如果你能坚持“不予关注，照章处理""，而对正确的行为如果你能“立即真诚地给予关注""，你会发现奇迹很快就会出现。"
