学生不能完成家庭作业怎么办？,"对老师来说，要求学生完成家庭作业是一个很常见的问题，特别是对于缺乏动力的学生。如果他们在课堂上不完成作业，我们还可以监督他们。但是，这些学生在家肯定不会完成作业。这有六种方法来鼓励学生完成作业，这些方法不会要你无休止地让学生留校，并承诺给予他们证书和其他的东西（或者说“贿赂""！）。1．确保你的作业对学生有吸引力一一在具备充分的挑战性、趣味、实践价值的前提下，你的作业越有吸引力，学生完成作业的可能性就越大。特别是有了像电视、游戏、朋友和现如今无处不在的 Facebook这样的竞争对手，如果他们觉得作业没有意义，或者说太无聊、太容易，那对他们显然就不会有吸引力了。作为一个长期战略，学生如果在完成作业后获得了自豪感和成就感，那么他们更有可能完成你以后布置的作业。2．作业是可以完成的一一一理想情况下，这应该是课堂作业的延续（而不是引入新事物），这样他们就知道怎样去做。学生需要知道他们的目标是什么，以及成果应该是什么样的。布置一些令他们一头雾水的作业是没有意义的，也不可能完成。3．可选择性一一一选择是一个非常惊人的动力因素，所以应该出现在家庭作业中。给他们一个任务选择（如“从下面5个任务中选出3个任务""），或者在呈现方法方面可以选择一一“制作一张思维导图、写报告、画插图、撰写杂志文章或者制作模型""等等。4．把作业写下来一一一定要确保学生在离开教室之前，把作业任务（以及任何有用的指示）记清楚，或者在博客/网站上上传好任务，这样他们随时都可以查看。这样就避免学生找借口说“我不知道做什么""。提醒学生，他们应该认真对待作业，并尽快完成。5．小组互动一一我们知道学生喜欢一起做作业，所以偶尔（甚至是定期地，如果这个方法有效的话）布置一个需要学生以小组形式完成的作业，这是有好处的。参与小组合作完成作业的个人责任感为完成作业提供了额外的动力。6．让父母/看护人参与进来一一如果你有孩子，毫无疑问你会分意识到家庭作业会给家庭带来多大的问题。父母会用哄骗、提醒、威胁、惩罚、贿赂的方式要学生写作业，而孩子们贝刂会撒谎、逃避、承诺、找借口、拖延。在许多家庭中，“第三次世界大战""几乎每天晚上都在这一问题上爆发，而在另一些家庭中就不会发生这样的情况。考虑到这一点，许多家长/看护人（即使那些看起来完全采取不支持态度的人）都会在家庭作业的问题上希望得到学校的帮助和指导，这也可能是获得家长支持的一种非常有效的方式。如果你很难得到一些家长的支持，那问题的关键就是要让家长相信你是在帮助他们和他们的孩子，让他们的生活更容易。你要是希望让对方觉得你这并非是为了自己的利益或者是为了达到学校的目标，而是为了帮助他们的孩子进步、取得成功、做的更好，你就需要向家长证明，他们的支持会对孩子在学校的进步有一个巨大的影响，从而对家庭生活也会有重要的影响，孩子会更快乐，生活更从容，家庭争吵更少，孩子被留校的次数也相应减少，要求去学校 “私人谈话""的次数也会减少等等。首先你要向家长解释，家庭作业的完成需要三个方面的努力一一学校、孩子、父母。如果要让这个协作正常运行，每个方面都需要依赖于其他两个方面的支持和投人。给他们看没有完成家庭作业的记录，并解释学校对未完成作业的处理办法和具体步骤。告诉他们这对学生来说既不愉快也没有益处。如果可能的话，可以给他们看一些统计数据，以使他们了解不完成家庭作业对整体成绩的影响。然后告诉家长他们可操作的具体事情，以此来帮助学生一起完成他们每天/每次应该完成的任务。他们需要一份作业计划表的复印件，包括交作业的时间以及完成每项任务所需时间。设置一个固定的、明确的时间段。比如4：30、5：30，这样可以帮助学生学习时间管理。试着鼓励他们在晚上提前设定时间，这时孩子还不至于困意连连，未知的突发情况也还没有出现。这样做的目的是为了养成一个习惯，建立一项不会过多地干扰晚上娱乐活动的常规。另一个提前设定时间的理由是，这能让不完成作业的后果发挥作用。如果允许孩子的家庭作业在最后完成，整个晚上孩子在写作业之前都是允许玩电脑或者看电视的，那么后果又如何能发挥作用呢？给家长必要的材料和物品清单表，以便学生在家里也可以得到这些物品（在某些情况下，学校可以提供这些）。对于学生可能会觉得有挑战性的任务，你可以提供一份“家长笔记""，这样他们就可以得到一些帮助和指导。我和很多文化知识严重匮乏的父母接触 过，他们很高兴我提供这些。最后，学生可能会从这些行为管理指导中受益，比如：在作业完成前，学生是不能看电视、打电脑游戏、玩手机，或得到零花钱的。你越容易使学生参与，他们就越有可能完成。不管我们什么时候使用这个方法，来自父母和孩子的反馈都是非常积极的，家长们喜欢花一些时间和孩子在一起，他们可能在很长一段时间里都很少和孩子安静地共处，学生开始享受成就感，家长也会增加他们的关注。"
激励那些家庭混乱的学生做家庭作业，你有什么建议？,"卢安．约逊：这里有两个问题。如果个人生活很混乱，那他们走进教室心情是非常沮丧的，所以，我认为让有些事情处于有序的状态是比较重要的，这样学生走进教室就会比较平静。不管你是做呼吸练习或是某种体力活动，还是写日记都可以，只要能够平复心情。我喜欢写日记，因为它给了学生发泄的机会学生可以在日记里写任何他们想写的东西，如果他们不想让我读，他们可以扔掉，或者让我回答，这个方法真的帮助了很多孩子。显然，我不是治疗师或警察一一我不能去改变他们的生活，但我可以说：“我在听你说，我理解你，让我们集中精力完成学业，然后你可以创造你想要的生活，我们会尝试找一些资源来帮助你处理当下的问题。”孩子们不做家庭作业有很多原因，但很多孩子不做作业，是因为他们不知道怎么做。他们习惯于抄袭别人的，或者作业不是他们优先考虑的事情。我建立了“家庭作业彩票""，因为我看到有成年人愿意每天花一美元或更多钱买彩票，所以我想，“好吧，他们喜欢有概率性的事件。""所以在我的课堂上，学生们把作业带过来并且已经完成，我就会把这些学生的名字写在“作业彩票罐""里，然后随机地拿出一个名字，这个学生就会获得一件奖品。学生不知道他们是否会赢得一支铅笔，或者赢得一个随身听。这些都不是我买的，而是我走访商业机构请求他们捐赠的，他们给了我CD，DVD，背包，书籍，无论什么我都有一一一很多快餐店会给我优惠券，我不会把这些优惠券扔掉，因为这仍然还是一种食物获取途径，如果有人饿了，我宁愿他们吃垃圾食品，而不是什么都不吃。这样，他们每次都不知道我会给他们什么奖励。你所要做的就是给他们几次真正好的奖励，然后学生就会开始养成做家庭作业的习惯。这能激励他们吗？我真的不知道。是激励他们去学习还是仅仅激励他们去赢得奖品呢？如果你是一名数学老师，你会说，“把这章节最后的难题做了""，那么很多学生都不会有动力去做。如果你说，“我想让你们看看这章末尾的问题，然后找出自己面临的两个难题，明天在课堂上我们一起讨论分享""，这是完全不同的事情。罗博：我们可以再进一步探讨这个问题吗？我去年在阿拉伯联合酋长国工作，在那里有个大问题，就是孩子们什么都有，有些还被宠坏了，他们认为做作业没有意义。事实上，是由于他们的父母传达的观念是他们不需要写作业。所罗门甄选出一个和这些学生有关的问题，“我们怎样才能激励学生做家庭作业呢？卢安：我想我们必须要问的是，这个家庭作业对学生真的会有帮助吗？还是仅仅是我对分数的需要？那我的问题是，作业对他们展现学习情况来说真的很重要吗？如果作业不能展现出他们的学习程度，那就将作业减半，但有时我认为家庭作业是没有挑战性的或者不值当的。罗博：我意识到我的一些学生不愿意做家庭作业主要是因为他们缺乏时间管理能力（以及学习资源和材料），所以不能完成作业他们居住的地方是混乱的，他们回家，看电视或做其他的活动，就是没有花时间写作业，因为这在家里不重要。所以我和他们一起坐下来谈谈如何管理他们晚上的时间一一他们可以在15、30分钟的时间里安排其他的活动，这样他们就不会错过任何事情。然后我们讨论了完成作业的所有好处，确保他们都有学习用具，如笔等等。他们非常感谢我所花的这些额外时间，有了这些完成作业的技能，他们做作业的可能性就大大增加了，事实上，这确实也解决了问题，他们也开始把作业带回来了。我们对这些孩子说过多少次，“你没把你的作业带回来一一你想让自己留校吗？""我们都是在一味惩罚他们，而没有考虑到学生们还没有得到他们所需要的技能。卢安：这是一个非常好的观点。我们还可以把学生分成小组，然后说“我有个问题，有同学的家庭作业没有完成，我需要你们的建议来决定如何改变这一切。""让他们告诉你。"
如何管理女生的行为问题？,"茱莉亚·汤普森：你知道，我将要告诉你的方法对我来说有效，但说实在的，我觉得挺荒诞的，因为我要把这个再用一次。下面就是我的解决办法。我总是试着找到这个问题的根源，会是什么呢？是一种权力斗争，这是二对一的权力斗争。由于这两个女孩和老师对抗，孩子妈妈被请来学校，她居然在走廊上给了这个学生一耳光。自始至终都在对她大喊大叫一一这太可怕了。因此我把班上学生分成两组去做一份作业，要学生写一些东西来帮助社区，他们表现的很不错，比如，在freerice.com这样的网站上做好事。我把她们俩分开，各自带领班上一部分同学，因此，这就会形成一种竞争，这种竞争不是和我，而是她们俩之间。她们以一种积极友好的态度，成为小组的领导者，各自专注于对抗对方，并试图打败对方，彼此相互竞争。这是件好事情，她们各自专注于对方，且是用一种积极的方式竞争一一这基本上是一种分而治之的方法，而不是一起来对抗我。在这个竞争中，她们要我成为盟友，我都已经不记得比赛是什么了，她们俩努力做好事，好让其他人加人。这些女孩很擅长让别人加人她的小组，所以要充分利用这一点。无论什么时候，只要她们有这样的力量，就要善用，成为一个乐于合作的好老师，专注于她们所做的好事，并重新引导这种能量。罗博·普莱文：在英国，我们有一个叫“世界最严格的父母"" 的电视节目，它的工作方式是挑选出两个在家真正非常难管的孩子，他们在家里辱骂父母，父母暴打这些孩子，唾弃他们，以及各种可怕的事情。这个电视节目会让家长在这些孩子面前展示一个新的“父母""形象一一一夫妻两个会和孩子住一两个星期，你可以看到，这个孩子行为一开始就非常糟糕。节目制作方会让你觉得别人可能没有办法在这么短的时间里改变孩子的行为，但他们做到了，每一次都得到了一个改变。他们会在半周的时间里把孩子带到某种环境中，比如医院、老人的家或者是残疾儿童中心，把孩子们介绍给他们做帮手。要孩子们为这些人提供帮助，每一次过后，这些孩子最后都会哭着说：“我从来没有意识到，和我比起来，他们是如此的不幸。""这些孩子在瞬间就会发生改变。我们每个人需要做出贡献，帮助他人，体会这种人与人相互关联、需要和有用的感觉。茱莉亚，如果你能像你解释的那样利用这一点，那我认为我们就是赢家。"
怎么让代课老师在班上获得尊重？	,"茱莉亚·汤普森：我喜欢这个问题。我之前做过两年的代课老师，每天15美元，我知道这个问题的答案。首先，代课老师不可能马上就得到学生的尊重，是在和学生接触后慢慢获得的。所以第一件事你要确保：你去学校的刊候能有很多额外事情带给学生做。你可以下载一些益智游戏或者带学生做课堂游戏。说实话，真的没有什么比老师说“给你们看一段视频""，但是视频却无法播放更恼火了。随后你就会困顿在满是让你发疯的学生的混乱课堂里。接下来，我建议每一位代课老师都要早点到校，这样你就有时间提问，问他们你还不了解的事。你知道，现在面前的这些人不是你认识的，也不是和你一起工作过的，但你可以咨询一下他们，以确保已经做好该做的了。如果有学生不喜欢你的计划，那就把这个计划告诉你学校的领导一一这样你就能得到他们的支持。然后，最重要的是你要记住，要想得到学生尊重，无论发生什么你都不要失去冷静。因为这正是学生希望和期盼的一件事，如果发生，那将会有个大场面。所以无论你做什么都不要失态。表现出你的自信，要表现得像你清楚知道自己在做什么而且会成功一一我相信这一点。罗博·普莱文：有一件事可以让他们马上对你失去兴趣，那就是带着“火药""走进教室，不是吗？这些学生不了解你，只是试图让你紧张。如果你不停地尖叫，大喊大叫，并试图制定规矩，那么你就会给你们的关系造成障碍。从那时起，得到学生的尊重就会很难了。我在当代课老师的时候，最能帮助我的一件事就是尽快了解学生。这一切都是你们关系的开始，所以不要直接进人课程，从“开始了解你""的一些活动或者一些游戏开始，这会让你和学生有一个良好的、积极的开端。你从不会看到任何一个治疗师在一位新客户身上施展魔法，而是要等到他们互相了解之后。你需要和学生建立起关系，如果可以的话，记住他们的名字。 15分钟内就可以做到。如果你专注于这件事，15分钟之内你就可以记住全班的名字，这就像魔法一样。在第一次见面的10到15分钟后，你就开始用名字称呼他们，他们会大吃一惊。这可以瞬间建立沟通和好感，显示出你对他们的兴趣。做这件事，有一个见效非常快的办法。首先制定一个座位计划。你需要一个你信任的学生去备份座位表，这样你就可以和学生注册表相匹配了。你也能确保没有得到假名单，这样也就可以列出班上与每个桌子相对应的学生名字座位表了。然后，要学生全神贯注于一项不需要接受你任何信息的活动，只需要5到10分钟，当他们低头的时候，你就可以在座位中四处走动，把他们的名字和脸匹配起来，这真的很容易做到。当你专注于像这样的小任务，结果会出人意料，你会惊讶于怎么能这么快把名字记住。如果你再花上10分钟在这节课上，在课程结束的时候，你可以把他们的名字都划掉一一这可能不会在第一次奏效，但很少在课堂结束时还做不到。我通常可以在10分钟内记住名字一一如果专注的话，任何人都可以做到。这件事的诀窍在于把学生的名字与他们的脸相匹配。我有一个相关的信息表，但基本上可以归结为联系到他们名字的固定图像。举个例子，如果我想要记住一个叫“罗博（Rob）""的学生，我就会看着他的脸，想象着他打扮成一个“强盗（Robber）""一一穿着一件条纹衫，背着一个""swag包""，或者穿着一条佩有宝剑的苏格兰短裙一一就像“罗伯特，布鲁斯""。无论如何，你只要尽可能地让想象变得疯狂一一一记住这些有趣的，就容易得多了。试一试，这会有效的。茱莉亚·汤普森：哦，你绝对是对的，罗博。让我来告诉你，作为老师，我是怎样做来让我的代课老师工作更轻松一些。首先，我给所有的学生拍一张日常照，之后我会定期调换他们的座位。用相机给学生们拍照后，我会打印出来。按照学生们在教室里坐的位置，我把名字写在照片下面。然后放在一个文件夹中，这样代课老师就知道是怎么回事了，学生坐的位置和名字可以对得上号。我试着让我的代课老师轻松一点，但学生们似乎依然在课堂上心不在焉。"
作为一名代课老师，在和学生建立融洽的关系方面，你有什么建议吗？,"卢安·约逊：你走进教室前，应当有一个计划，也就是你的日常工作事项，不是学生的，我认为这一点很重要。你要做一件像破冰船一样的事情一一做一个5到10分钟的活动。这样你就有机会了解孩子们，还可以按计划直接进人课堂。但我认为还应该有其他的课堂计划，以防活动太容易或太困难，或者你遗失了课堂资料。无论如何，什么都有可能发生。在上课之前我会去做另外一件事，与一位辅导员碰面，查看班级名单，并询问：“哪些学生是值得信任，并且能够帮助我的？"" 你不需要去询问谁自愿当你的小助手，因为有些学生愿意，有些人不愿意。所以我问辅导员，哪些同学我可以询问，当然我不会把辅导员的名字说出来，说出辅导员推荐他们的话，这样会让学生认为他们是班上的领头人。我也不会直接进人课堂，践行我老师的角色。因为，首先，你不知道他们是谁，也不知道他们说的是不是真话，而且，你在执行老师这个角色时，学生们看上去很忙，事实上他们在私下交谈，这样也不是一个真正的课堂。你可以复制一套不同的视错觉图片，把每四个不同的视错觉图片随机分发给学生，告诉他们，“好了，我希望你能找到和你有相同的视错觉图片的人，然后成为一个小组。我希望你们看看自己能否发现视错觉的原理，我过会儿会回来，向你们小组讨教。""这样，学生就会立刻投人视错觉中，即使他们不想，但是只需扫一眼，大脑就会被激活。然后你要告诉他们为什么做这个，“好吧，让我们看看你的视错觉是什么？""这时，你已经把注意力从自己身上转移到学生身上，让他们大脑激活，自己的角色也开始发挥作用了，且已经准备好上课了一一学生给了你开始上课的机会。我学会了这个比较难的方法一一不要直接就进人课堂，一开始就发挥自己角色的作用，也不要到处乱翻学生的作业。"
如果不是自己的班级，怎么让有极端行为的学生变得有积极性？怎么克服学生抛给我的难题，比如“让我们看看，我们能给代课老师多大压力”？,"安吉拉：这是一个非常特殊的情形，我认为，你能做的最重要的事情就是保持冷静。你所表现出的态度会对学生的感受和反应带来巨大的差异。谨慎选择自己的方法，记住这只是这一天的事情，就像你身为父母一样，你不会像对自己的孩子一样高标准要求别人的孩子。当代课老师时也是一样的。你不会对他们的生活产生影响，也不会对他们有所控制，所以你只要在学生面前树立起冷静、淡定的形象，这样学生就会知道他们骗不了你，之后也不会。你的工作就是扮演一个冷静、神志清醒的老师，甚至在你想要尖叫、抓头发、跑出教室时也要这样。按照你预期的良好感觉行事，通常会进行顺利。小心谨慎地和他们磨合。有一个例外是，如果你要和这个班待很长的时间，那么我建议你建立自己的奖励机制，建立自己的常规办法，告诉孩子们，“如果你们的老师回来了，你们会按照她的方式来做；但当我在这里的时候要按照我的方式来做。""然后讨论为什么要用这样的方式。所以，如果你是做一个长期的代课老师，你就要负责管理这个班级，就好像是你自己的一样。"
