如何管理愤怒、目中无人的学生,"对于愤怒、目中无人的学生，下面有一些班级管理策略。1．保持豁达和平静。这种挑衅行为通常是为了寻求别人的帮助或试图掩盖对失败的恐惧。没有人想在别人面前显得很愚蠢（除了那些无知的孩子），反对权威是一种分散注意力和避免看起来愚蠢的有效方法。你应该对学生的需求以及他们行为背后的动机有敏感度，而不是认为他们是好战的，这样你就不太可能去做一些或者说一些会让情况变得更糟的事情。记住，他们的行为很可能不是针对你的，所以尽量不要感情用事。2．提供帮助和支持。提供支持是一种非常积极和完全没有对抗陸的第一反应，因此是应对那些给自己“挖坑""的学生的好办法。这也能够加强师生间的关系。“我看得出你已经开始了，但你需要我再解释一下吗？如果我先让你开始另一道题，这会有帮助吗？""“你需要喝点什么，或者想呼吸新鲜空气吗？“我看得出你对这件事很生气，你为什么不去那儿安静地坐一会儿，然后告诉我你什么时候需要我的帮助？ ”"" 我能做些什么让你更舒服些？”3．寻求学生的帮助。要求班上其他学生的帮助，给他们来个措手不及，并立刻改变他们的消极状态，这比我尝试过的其他任何方法都更能解除青少年的愤怒，让他们守规矩。我认为，在某种程度上，我们都喜欢被人“需要""，这是利用人类本能特征的最简单方法。“约翰，我知道你在技术装备上很不错一一你能帮我安装AV套件吗？我们可以在那之后再谈你的家庭作业。”“西蒙，我有点问题。我儿子在学校里和他的老师很较劲。你让我想起了他，我对你在过去的几个月里改变自己的方式印象很深刻。你能给我一些建议吗？""“托尼，我可以帮你的忙。我不想你一直困扰在这件事上一一一 你对我们如何应对有何建议？”4，赋予班级责任感。最难管的学生往往具有领导才能，并且非常渴望关注。你可以赋予他们责任感来满足这种需求。这可能有显著（而且非常快速）的效果。试着让他们负责设备管理，或者让他们担任一个职责、一份差事，比如让其他学生安静下来。5．避免班上同学带来的压力。一些学生试图当着同学的面把矛盾升级。如果可能的话，私下和学生交流，或者引导他们晚点再处理这个问题。“我们不要在这里谈这件事一一这对我们俩来说都很尴尬。午饭时间来找我，这样你就能告诉我让你感到困扰的事情了，你可以早点来，这样你还可以有休息时间。""6．缓和、转移和化解学生的愤怒。任何形式的转换，如问一个与今天话题不相干的问题或者转移到新的活动，都可以转移他们的注意力，减少愤怒，也能改变他们的状态。我曾故作天真地对一个非常愤怒、正在发脾气的十几岁男孩提出问题，这个问题是：“你的袜子是什么颜色的？""他听到后状态立刻变了，脸上的表情从愤怒变成茫然，他站在那里，困惑地看着我。他的情绪改变了，我们都笑了起来。“你的袜子是什么颜色的？""（或者其他同样随机的问题），这就是我的处理办法。另一个缓解愤怒的策略就是不做出反应，什么都不说，只是看着他们。也不去故意寻找和询问不相关的话题。在这种时候，沉默是非常有力的。学生想要得到你的回应，你可以用冷漠的眼神看着他们，并且保持沉默不语，这样能清楚地传达出你能完全控制住，不会卷入这种争论。对付那些想要争论的学生，要让他们停下来、思考和反省他们的行为，最好的方法就是拒绝给出任何回应。7．给学生成功的机会。任务要能够投其所好，并且符合他们的能力水平。这样就会让他们有机会感受成功还能增强自尊心。如果害怕在同学面前失败导致了他们的消极行为，他们就需要有足够的机会体验到成功，感受到“啊哈！""欢乐时刻，这能改变学生的态度。在感到成就感时，就很难感到厌烦。8．对于态度有改善的要表示承认。在面对特别难管教的学生时，我们很容易一直关注消极的行为。想让学生的行为做出持久性的积极改变，最快的方法是给予积极的评论。你最后一次做让恼人的学生感到开心的事是什么时候？如果他们稍微有一点改善，就赶紧抓住这个时机，抓住这个闪光点。具体地告诉他们做了什么以及你为什么对他们如此满意。9．鼓励和促进小组合作。要使学生对学校的消极态度得到化解，就需要建立并持续发展与同伴（及老师）之间的积极关系。所有的学生（特别是那些消极孤立的人）都需要感受到班级的欢迎，是班里的一部分。定期的团队建设活动、小组合作任务，可以加强同伴间的关系。10，按照学校的行为规定让学生承担后果。例如：让他们搬到单独的座位上。让他们课间休息时/放学后抽出时间来见你。信件/电话通知学生家里。把学生寄存在另一个班上。把学生送到学校领导那里行为后果可以给学生警示，提醒他们如果继续下去的话要承担什么样的后果。试着让他们“花时间""听从你的指示，而不是只是站在学生面前，期望他们能立即服从你。在伴随来自其他同学的压力时，这是个艰巨的任务。“克里斯，这是我第三次，也是我最后一次让你坐下。你已经受到了警告，你知道接下来会发生什么，如果你还继续这样的话。这是你自己的选择。""“约翰，如果你现在不开始，你会……（待选择的后果）。这真的是你希望的吗？我要去帮助约翰，两分钟后就回来。我希望在我回来的时候你们已经完成了第一个问题。如果你们不做，就得在休息时间完成它。这是你们自己的选择。"""
我怎样才能管住难管的学生？,"安迪·瓦什：有件事会阻碍有效的教学，这就是试图控制学生一一你控制不了的，我知道的老帅没有一个能控制孩子。我们要做的就是说“不""。即使把学生带出课堂、把学生送到学校领导那里、送到校长办公室或者送回家，我们也不能控制住他们，我们也赢不了一一这不是比赛。我们唯一能控制的就是我们自己。我不知道你是否知道一本史蒂芬·柯维写的《高效能人士的七个习惯》一一他有一个小方程式，我经常把它叫作E + R= O。即事件加上你选择做出的反应决定着结果。这里我使用这个词反应而不是反抗。反应意味着冷静、慎重、自信，它传递着平静、专业、思想、认知。所以控制等于信心。要控制你的内心对话，控制你的心理，控制你的行为，这肯定等于自信。但是，看在上帝的份上，不要试图控制孩子，因为你会消耗大量的精力，并且悲参地失败。"
 当任务有挑战性时，这个学生会双手抱臂，拒绝做任何任务。我把班级分成小组时，她会告诉我，她愿意和谁一起完成任务。这个学生在班上占主导地位，其他学生都跟从她，我该怎么管理呢？,"用应用行为分析的A一B一c分析可以认为：她这种行为是为了逃避她不喜欢的东西（负面强化）。从事心理教育的人和德雷克斯的“错误目标分析""认为：这是处在寻求关注和寻求权力的阶段。虽然我承认A一B一c评估的有效性，但认为它只是用来识别影响。应用分析者们不会冒险评判人的思想。我倾行为的“表面""因素向于认为，她这种行为是想和你保持联系——渴望“属于""你（“德雷克斯""模型）。按照这个思路，我建议你建立一个系统，让学生与你有机会相处。此外，教导她一些其他的行为以获得她想要的，并且她表现出这种行为的时候，自己也能意识到。在行为问题咨询网站BehaviorAdvisr.com上你能找到一些方法，这些方法能帮助你教导学生好的行为。你要转变依据其在测试、任务中的分数给予表扬的方式，对努力和进步多加认可。个中原因可以在行为问题咨询网站上找到（点击“干预策略""，向下滚动到关于表扬的页面）。在行为问题咨询网站BehaviorAdvisr.om的干预策略中，查看“问题解决""的页面。这是一种利用谈话来刺激改变的方式。"
如何管理特别难管的班级？,"下面的 些课堂管理策略，可以帮助你应对极其难管的学生。1．分而治之。根据座位安排把学生小群体分开。告诉他们，如果他们想和自己的朋友坐在一起，他们就必须获得这种特权。用日历把这学年的课程数量标示出来，告诉学生只要他们安静并且认真地完成学习任务，你就会在10次课之后调整座位。这样，只要他们举止适当，他们就能和朋友坐在一起上完一年中的大部分课程。2．大量使用真诚的赞美。学生表现不错时，要积极地承认并感谢这个小组的学生。你可能需要找出赞美学生最好的方法。一些学生很幸运，他能成为班级同学普遍支持的一员，他也会感激来自大家的赞扬，但是，有些学生受到老师表扬后，会被嘲笑为“伪君子""。所以试着在教室外（在课前/课后）进行私下的表扬，也可以是书面表扬一一寄卡片或者信回家。若消极的行为变得根深蒂固时（就要像对待一个非常难管的班级一样），关注学生所做的正确的事情是扭转趋势的最好方法。3，坚持在每节课上做短时间静默训练。提供一些不同难度的任务选择，让学生选择他们想做的，但是一一要坚持让学生做这项任务时保持安静。坚持短时间静默训练（最多10次）可以让学生（和你）从持续不断的噪音中解脱出来，另外要提醒他们你是负责人。4．不要为了让学生听到而提高音量。任何一位想要自己的声音盖过教室噪音的老师，都会被学生认为是软弱的，会被学生忽视。要等到他们完全安静，然后再跟他们说，要轻声说话（如果你说话的音量比平时小的话，这就会让学生更努力听你说话），对于扰乱课堂的噪音时刻要限定次数，以免严重妨碍课程进度。如果你要做出很多指示，那就悄悄地先去解决小群体和个人，而不是整个大群体5．保持积极的态度。目前有种趋势，在面对混乱不堪的班级时，老师不再努力去吸引学生的注意力，而是用枯燥、乏味的课程任务和消极的课堂管理策略来惩罚他们，这样是可以理解的。偶尔要求抄写黑板上的知识点或者上一节练习题课可以帮助他们查缺补漏，也可以让你自己好好休息一下。但如果这些乏味的活动成为常态这无疑会导致状况恶化。要相信好教育的价值，让学生看到你希望他们成功。问他们想在课堂上做什么类型的活动，并将学生的建议放在可行活动的列表中，到时候他们会尊重你的。"
我正在教的学前教育阶段的4岁孩子，学生注意力时间短是个问题。你能给我一些快速吸引注意力的方法和建议吗？,"悄悄说：“谁能听见我，请举手。""降低音量（而不是大喊大叫）引起注意。当孩子们发现你的声音更难听到时，他们就会互相提醒。表演是吸引学生注意力的重要部分。在声音和行动上要有戏剧性。和你的助理教师互动。这种互动有助于使学生保持注意力。问学生问题：“在接下来的2分钟里，我会问某个同学一个问题。那会是谁呢？我们来看看。请仔细听。""（注意说话的节奏和韵律。）“谁能给我演示一下，我们怎样走回到我们的座位上？"" “谁能给我演示一下，在地毯上，我们怎样坐得像椒盐脆饼？""对做的好的，给予表扬。表扬青少年的正确行为来吸引“涟漪效应”．使用“竞拍式""的赞扬或行为叙述。说：“我看到3个同学准备好了。我可以看到5个同学准备好吗？好的！我可以看到10个同学准备好吗？用一段咏唱可以把学生的注意力吸引到你身上：你说“ 1一2一3，看着我。”他们说，“ 1一2，看着你。” 和他们一起练习，使之成为习惯。"
在我的学校，有很大一部分学生都有着严重的行为问题，那么你会对这些学生的行为抱有同样的期望吗？如果对他们的期望落空了，而其他学生认为他们总是能侥幸逃脱对这些不当行为的处罚怎么办？,"安吉拉：你知道我在这种情况下会做什么一一一这有点不合常规。每个班级都会有一些难管的学生，如果你够幸运的话，就只有两个或三个。我们老师要做的就是在其他同学面前假装这些学生不难管，因为我们要维护一个冷静淡定的形象，这其实很好。其实，班里其他学生不笨，他们知道谁是捣蛋鬼。并且知道问题是什么，也很清楚发生了什么。有一年，我有个学生，在课堂上变得极端暴力，向同学扔课桌，还有其他极其不当的行为，我意识到是时候不再假装什么事都没有发生，应该让事情变得缓和一点，并且让整个班级参与到这件事的讨论中来。我认为结果还是不错的，于是后来即使没有这么严重的行为，我也开始这样做。当时我的做法是，在学生平静下来之后（我叫他凯文），我对全班同学说：“你们有没有注意到，凯文有时会控制自己的愤怒，你们有这样的感觉吗？你是怎么对待愤怒情绪的？""我们谈到了对愤怒情绪的正确反应以及不正确的反应，我问道：“作为一个班集体，我们能做些什么来帮助凯文控制他的愤怒？""我把这些建议写了下来。现在我已经做了所有我在网络研讨会上与同行分享的事情，建立一个课堂社区和一个支持性的学习环境，孩子们会习惯于像这次课堂一样解决问题。凯文一点也不会感到难为情。因为他听到我把各种各样的问题拿到课堂上来谈论，他知道这些谈话是来帮助他的。在那次谈话之前，我觉得我是独自面对这个孩子，学校没有给予我足够的支持，我试图躲避他，还保护班上其他的同学以免受到他的伤害，但从那一刻开始，我觉得我们都处在同一战线，其他学生一起努力来帮助这个孩子。如果凯文生气了，他会撕下一块告示板，我知道这个时候最好不要打扰他，这时去回应这件事我不再感到有压力。其他的孩子们也不再看着我，好像在说：“你打算怎么做呢，他会逃脱惩罚吗？"" 相反，他们开始以同情的眼光看着我和他，学生们试图安慰他，他们试图用我们谈论的技巧让他平静下来，我跟这些学生说，“孩子们，凯文说他需要空间冷静下来，因为他很生气一一一记住了吗？所以，现在不要打扰他，让他一个人呆会儿，我稍后再和他谈。""所以，对于你问题的答案是肯定的，对有严重行为问题的学生我们的标准要和其他学生一样。在某种意义上，你要让这些学生渴望达到标准，但是如果学生没有达到标准，或者说这对他们没有改善的话，你每次也不用太着急，去气恼地惩罚他们或者和他们对峙。你要把重点放在建立课堂社区上，让每个人一起学习，鼓励孩子进步，这对你来说也是一种进步。如果有人问你为什么要让这个孩子逃避不当行为的惩罚，你可以说：“他只是现在没有做出正确的选择。对我们所有人来说，自我控制有时是有困难的，但是他在努力。你在这方面表现不错，而且你能立马做出正确的选择，你应该感到骄傲，所以作为一个集体，我们要一起学习，帮助每个人在自我控制方面都做得越来越好。"""
如何激励那些已经摆脱令人沮丧的家庭环境的学生，怎么消除这种在家庭中受到的自尊心伤害？,"安迪·瓦什：这很可悲，也很艰难，这是充满爱心的职业。我们总是希望孩子们生活能有所不同，但是当我想到这个问题的时候，我突然想到了一些事情。其中一个是关于海星的故事，有成千上万的海星被冲到海滩上，还有人在沙滩上行走。他们尽自己最快的速度把海星扔回大海，有些人说，“你在浪费你自己的精力，这有成千上万的海星会死，你还是没有改变它们。""他们却说， “不管怎样，能救就救。”但重要的是，我们可以做出不同的选择，而不是我们想做但不能。关于特雷莎修女呢？人们说：“你为什么要给这些人一张床，他们在几小时内就会死去？""她的回答是，“就这样，在他们的生活中，他们知道有人关心他们。""而我认为这正是我们必须跨越的。所以当我看到这些学生时，我告诉他们关于他们的事情，关于他们是一个什么样的人，而不是他们的行为。“我看着你们，看到有些是聪明的人，有些是善良的人，有些人爱分享，有些人可以做朋友""诸如此类。我记得和一个女孩一起工作的时候，别人告诉我她非常顽固，但我把她当成一个非常有决心的人。这就是我们如何构建一些东西，我们的一些信念，甚至是对孩子的偏见。还有其他的一些，我不能详细列举，因为时间关系要使用反馈而不是表扬。你表扬他们的时候，自卑的孩子是不会相信你的。记住，我们只有在做了让自己感觉好的事情时才会感觉良 ""	一起玩这个游好。所以强调“做 “当我看到你邀请米歇尔和你戏的时候，这让我觉得你是那种非常善良和体贴的人。""再一次专注于做。“你写了日期，你写了标题，你已经开始用铅笔画画了一一我想你对这很满意。'保持描述性的反馈，而不是赞扬和评判，因为自卑的孩子不相信你。"
如何管理学生争斗和严重的事件？,"下面有9个方法能快速缓解争斗和处理严重的事件。1．避免问“为什么”。在处理学生的行为、态度问题时，应该避免使用“为什么""这个词。问学生为什么他们有或没有做过某事是一种极端对抗和威胁的方式，这样总是会导致更多的冲突。问学生为什么，会让他们心理设防，如“你为什么这样坐着？"" “你为什么要这样做？' “你为什么不听？""你能看出这些问题是如何引发更多争论和冲突的吗？如果你不相信这是真的，你可以在晚上用同样的问题问你的伴侣，但是你要把多余的房间准备好！一个比较好的选择是去问“怎么样""或“什么""这样的问题，让人们有机会解释自己，而不是让他们感觉自己被指控了。“是什么迫使你想要这样做？ “你是怎么想的呢？ “你怎么能保证这事"" 	"" 不会再发生？ “你怎样能做得更好？ 2，转移注意力。分散注意力的方法可以是：1）变换活动（总是有一个备用游戏） 2）将注意力转向附近的演示或其他事情（“过来看看这里""）3）一个故事或笑话（“嘿，我听说你本周被选为足球队的队员了……你为什么不告诉我更多信息呢？""）在我和那些被主流学校排除在外的学生一起共事时，我意外地发现了娱乐活动的力量。我带他们去公园玩足球，两个孩子之间爆发了一场打斗。我把他们分开，安德鲁非常紧张，我把他带到旁边，试图让他平静下来。他完全失去了控制，号啕大哭，大声辱骂其他的男孩，我所说的和做的似乎都对他不起作用，完全歇斯底里。有路人走到这附近的时候，我感到很尴尬。我看着地上，整理思绪。安德鲁的袜子突然引起了我的注意，我惊讶地听到自己对他说： “哇，安迪，你的袜子是什么颜色的？这是一个完全偏离主题的问题，显然对他来说也是一个惊愕。仿佛变魔术似的，他立刻沉默下来，低头看了看自己的脚，然后用一种古怪的表情看着我。尖叫和咒骂停止了，他一动不动地站着。我回头看了看他，几秒钟后，我们站在那里互相凝视着，然后笑了起来。我平常用的让他冷静下来的方法都失败了。我试着给他警告、给他讲事清后果。试着鼓励他、哄骗他，但是当一个人处于疯狂状态时，这些就不起作用了。在这个例子中（我认为这是一个很好的全面降低事件严重性的策略）起到作用的是彻底、快速地改变学生的心理状态，从而打断他们的思维模式，阻止他们陷人歇斯底里的状态中。任何偏离主题的问题都应该尝试，或者，如果你更有冒险精神，你可以改变你的行为，做一些他们意想不到的事情。不过尽量不要打骂他们。3．提醒他们过去的成功。“回想一下昨天，你还记得我们的谈话和你的表现吗？""“还记得上次发生这种事时你是怎么处理的吗？""“嘿，我看到你今天早上表现得无可挑剔。来吧，回到你真实的自我。""4．沉默。看着他们。让他们咆哮、再咆哮，风暴最终会自行消失。然后问他们： “这到底是怎么回事？出什么事了？当你不想成为他们的敌人，而只是“倾听""时，你可能会很惊讶地发现，学生竟然会打开心扉愿意和你一起。有选择性的沉默是应付难相处的人的最有效方法之一。这也很容易使用，而且威胁性非常小。当人们遇到困难时，往往会寻求关注和力量。当你对攻击做出口头回应时，就会给予他们所渴望的注意力和力量。而使用选择性沉默，就否定了他们的消极渴望。5．给予支持。“你想要我怎么帮你？"" “我们怎么解决这个问题呢？6．使用幽默。“冷静下来。屏住呼吸，直到你变成亮紫色，然后我们再讨论这个。""7．给学生空间。“我不想让你离开，但我也不想让事情失控。这样怎么样？如果你需要离开房间，让自己平静下来，我能理解你。这是门，你现在可以出去，在你做好准备、没有难受的感觉时就可以回来了。8．拒绝成为他们的敌人一一认同他们或向他们道歉。“我认为你是对的。你让我觉得，我可能是有时太霸道了。你愿意接受我的道歉，让我们重新开始吗？“我们都不想让这件事变得更严重，所以先把这件事放一放。 如果你愿意的话，我们可以晚点再谈。”9．给予他们部分同意。可以通过承认他们的担忧或给予他们部分同意来避免和学生发生冲突。可以这样说——“我同意这看起来不公平，但是……”“可能是真的，但你仍然需要……”假设一个老师让一个孩子停止说话，学生可能会否认他们在说话。然后老师坚持自己看到学生在说话。他们之间就会产生“是的，你是"" / “不，我不是""这样来来回回的争吵。然后，学生就会向旁边的人求助，并向他们抱怨自己总是被欺负。这样班上学生都会停止学习，来围观这场争吵。整个事件就会升级。这里有一个使用“部分同意策略""的例子。老师：弗雷德，你得停止说话。弗雷德：我根本没有说话。老师：也许你是对的。那你只需要完成练习题三如果你表示同意，他们就不会有什么争议。所以，学生就有可能把事情做对，而且不会丢面子。"
