1019,房山文化底蕴深厚古往今来这里遗存了众多书法珍品其中既有帝王手迹也有名家墨宝下面第幅作品方正严谨属于楷书；第幅作品潇洒灵动属于行书
1020,请翻译下面句子1.故曰：域民不以封疆之界固国不以山溪之险威天下不以兵革之利2.得道者多助失道者寡助3.丈夫之冠也父命之;女子之嫁也母命之4.故天将降大任于是人也必先苦其心志劳其筋骨饿其体肤空乏其身行拂乱其所为所以动心忍性曾益其所不能
1021,翻译下列画横线的字1.环而攻之而不胜2.委而去之3.固国不以封疆之界4.寡助之至5.是焉得为大丈夫乎？6.得志与民由之
1025,非宁静无以致远（《诫子书》）
1028,解释下列语句中加点词的意思止有剩骨止：弛担持刀弛
1030,第④段狼“目似瞑意暇甚”时是怎样想的？屠户又是怎样想的？请分别以狼和屠户的口吻写出两者的心理活动狼想：屠户想
1040,下面这则材料适合放在文中哪一处？为什么？德国法兰克福书展上《朗读者》的制作人与德国友人分别用中、德两种语言朗诵了散文《写给母亲》令在场观众潸然泪下关于母亲的文字把爱与爱连在一起也把中国与外国连在一起放在：】处理由
1045,京杭大运河流淌着的不仅是波光粼粼的河水更是绵延不绝的中华文明某学校组织了“走进京杭大运河感受运河文明”游学活动请根据要求完成1－5题大运河就是一条流光溢彩的“文学之河”我们熟悉的许多文学作品与大运河都有渊源如元末明初的罗贯中早年生活在大运河边的杭州、苏州等地有学者指出他就是在大运河边的淮安完成了“四大名著”之一的章回体长篇小说
1049,古人对数字的表达和现在有所不同比如“二八年华”指女子16岁“花甲重开外加三七岁月；古稀双庆内多一个春秋”这副对联是清朝乾隆皇帝出的上联暗指一位老人的年龄；当时名臣纪晓岚对了下联联中也隐含这位老人的年龄根据文化常识和数学知识这位老人的年龄应是岁
1054,孝公既用卫鞅鞅欲变法①令既具②未布③恐民之不信已乃立三丈之木于国都市南门④募民有能徙⑤置北门者予十金⑥民怪⑦之莫敢徙复曰：“能徙者予五十金”有一人徙之辄⑧予五十金以明不欺卒下令令行于民期年⑨秦民之⑩国都言初令之不便者以千数于是⑪太子犯法卫鞅曰：“法之不行自上犯之”将法⑫太子太子君嗣⑬也不可施刑刑其傅公子虔⑭黥（qíng）其师公孙贾⑮明日秦人皆趋令⑯行之十年秦民大说⑰道不拾遗⑱山无盗贼家给人足民勇于公战怯于私斗乡邑大治秦民初⑲言令不便者有来言令便者卫鞅曰：“此皆乱化⑳之民也！”尽迁之于边城其后民莫敢议令（节选自《史记·商君列传》）[注释]①变法：公元前359年秦孝公任用商鞅进行第一次变法孝公秦孝公卫鞅卫国人姓公孙名鞅他在秦国变法有功受封商地历史上称商鞅②令既具：法令准备就绪以后令指商鞅为秦孝公变更法度定制的命令既已经具准备就绪③布：颁布公布④国都市南门：指都城后边市场南门⑤徙：搬⑥金：古代货币单位⑦怪：对……感到奇怪⑧辄：就⑨期年：一整年⑩之：到……去⑪于是：在这时⑫法：处罚、治罪⑬嗣：继承人⑭刑其傅公子虔：处罚了监督他行为的老师公子虔傅师傅指负辅佐责任的官或负责教导的人这里是指傅父古代保育、辅导贵族子女的老年男子⑮黥其师公孙贾：以墨刑处罚了给他传授知识的老师公孙贾黥墨刑在面额上刺字以墨涂之⑯趋令:服从命令⑰说：通“悦”喜悦、高兴⑱遗:东西⑲初：当初⑳乱化：扰乱教化上完历史课同学们对商鞅变法取得的巨大成功产生了兴趣于是大家展开了探究有同学从上面这个故事中归纳出变法取得成功的两点原因你认为是
1056,我什么也没有看见！这可hàiréntīngwén了
1058,阅读现代文完成19-21题2019年的金秋我随《香港商报》组织的作家采风团来到兰州当飞机在空中缓缓飞翔开始降落时我不由得大吃一惊碧蓝的天空下面一座五彩斑斓的城市中间分明有一条大河穿越而且这不是一般的河流而是大名鼎鼎金光闪闪的黄河！从高空俯视黄河犹如一条金色的腰带柔软的波浪在车水马龙在广厦万间的城市中间自由地流淌大诗人李白曾挥笔：“黄河之水天上来……”我想他应该这样写下句：流过兰州宽阔的胸怀！……特别是当我攀登到我下榻的白云宾馆真就弄不清我是走进梦境还是仙境因为夜色刚刚降临宾馆的窗外五光十色地闪烁黄河两岸所有的楼厦墙面犹如巨大的电视屏幕都在放射着赤橙黄绿的耀眼画面猛然间我发现就在这迷幻般的光彩中黄河竟然贴着宾馆的楼根浩荡前行！我像个孩子在心里不断地惊呼这是黄河吗？这真就是黄河吗？这真真就是我在书本上在梦境中在世界江河的排行榜上看到的黄河吗？……我在窗前足足站立了半个小时欣赏着现代与历史交辉的壮丽场景因为我感到宾馆的大玻璃窗也是个巨大的电视屏幕我用手机拍摄窗外的视频发给家乡的朋友们他们惊呼问我这是欧洲还是美洲是世界上哪一个外国？我立即斩钉截铁地回复这是中国的兰州然而朋友们百分之百地不相信这怎么会是兰州？怎么会是那个荒凉的西部城市！……但仅仅是在几个小时前在我从家乡大连机场登机时我也与我的朋友们有一样的想法认定兰州是荒凉的西部城市再美能美到哪里去呢！肯定是风沙滚滚肯定是严冬酷夏肯定是令人呼吸困难的高原……我突然为兰州感到委曲同时为兰州感到骄傲第二天一早我在黎明中就走出宾馆房间站在观景台似的宾馆门前呼吸着清爽的空气因为此时沿海城市的大连还在混沌的热气中蒸腾而这里却是避暑胜地昨晚电光闪射的斑斓场景悄然而逝城市建筑从五彩的光色中显露出真正的面容国画一样的山水楼阁渐渐凸现出立体的美感突然一轮红日从东方从黄河滔滔向前的尽头冉冉升起像一个硕大的蛋黄那样亲切那样温柔世界变得清晰了陡然这个亲切的“大蛋黄”爆发出火热的激情骤然射出万道金光国画般淡青色的城市也瞬间亮出坚实并优美的形象她怀抱里的黄河此时似乎是激动了千千万万涌动的波浪犹如千千万万金色的小手充满滔滔不绝的情感一齐朝红日升腾的方向挥舞俨然拥抱升腾的太阳我真切地感到黄河的水波是那样金灿灿的黄兰州的天空是那样明朗朗的蓝是黄河的金黄显示出兰州的湛蓝还是兰州的湛蓝衬托出黄河的金黄？黄河啊黄河你使兰州更加靓丽兰州啊兰州你使黄河更加壮美猛然间电击般的灵感在我的脑海里闪现出一句话：这就是我要写的文章题名兰州是我国有名的工业城市著名的“兰化”就座落在这里工业污染是全世界城市都很难解决的难题兰州怎么会如此“春光明媚”呢？后来经过了解才知道为了这一片片绿色的城市屏障兰州人付出了数十年的艰难辛苦并真正达到了艰苦卓绝的业绩因为我乘飞机从大连飞向兰州时途经黄土高原的上空就已经感到大自然的严酷可过了黄土高原再往西更是一片接着一片光秃秃的山梁沟壑只是接近兰州才突然看到绿宝石般的世界以为这是大自然对兰州的赏赐其实是兰州人的奋斗成果问题是在沿海城市的山区里栽活一棵树都相当艰难而在兰州火烧般干渴的荒山上栽树谈何容易！英雄的兰州人却为此而奋勇拼搏他们在干硬的荒山上挖出成千上万个深坑趁黄河封冻时凿出一块块冰团车拉人抬肩扛将成千上万个冰块送上百米高山埋入土坑里第二年春天到来这些凝固的黄河冰块溶化滋润着成千上万亩干渴的荒山然后嫩绿的小树苗在黄河滋润的荒山上茁壮成长一年一年拔高终于成林正因为树林面积扩大这些年兰州的雨水也就多起来令作家们十分敬佩的是在流经兰州的150多公里长的黄河两岸特别是在市区沿岸兰州人已经建起将近200万平方米绿地；12万多平方米绿化带犹如长城一样耸立在黄河沿岸16000多株行道树整齐排列；11个公园14组雕塑群美化着这座大河流经的城市但兰州人并不满足他们成立的“兰州黄河风情线大景区管理委员会”正继续全力奋战美化了再美化实施夜景亮化工程更上一层楼地提升兰州城市品位短短的一周我们采风团在兰州不但是走马观花简直就是“跑”马观花但就是“飞”马观花也只是看到兰州风光的一角所以当我采风结束后兰州的每一处绿化、每一种景观都让我流连忘返仿佛我不是要返回故乡而是正恋恋不舍地与故乡离别为此当我回到大连下飞机的第一个念头就是想转身再度登上飞机飞回可亲可爱的兰州！……作者：邓刚（有删改）梳理文章内容完成表格
1059,下面是一位同学阅读《鲁滨逊漂流记》后写的一首小诗既包含了鲁滨逊的经历也赞美了他的精神请你结合名著补写合适的内容传奇这是一个空无一人的荒岛这是一个没有硝烟的战场你孤军奋战与自然抗争向命运呐喊艰辛搬运造屋安家无畏的精神是你挑战命运的武器开拓的精神是点燃你希望的明星酿酒制陶造船挖渠是照耀你梦想的光芒你的故事注定是一个传奇
1064,活动结束学校要向大家征集活动感言请在“红色、红歌、奋进、热爱、英雄、纪念”这几个词语中至少选择3个连缀成一段话表达你对家乡的真情实感答
1066,劝说是一门艺术当朋友陷入困境、找不到出路时你可以借用陆游的“山重水复疑无路”鼓励其坚定信念勇于开拓；当朋友考场失意、意志消沉时你可以借用李白的“直挂云帆济沧海”帮助其重燃斗志；当朋友因离别而伤感时你可以借用两句慰藉其心灵
1068,阅读“长安居大不易”的典故完成填空白居易16岁时诗才已经不同凡响但不为人知那年他只身到了京城长安拜访当时掌管编纂国史以及为朝廷起草文告诏令的著作郎顾况顺请老诗人对自己诗作进行指点顾况是一个自视甚高的人看到白居易递上的名帖一眼瞥见“白居易”三字遂禁不住开起玩笑：“要知道京城长安现在物价高得很平时就是想居住下来也挺不容易呀更何况要白白居住！”说归说老诗人还是浏览起白居易呈给他的诗稿当看到《赋得古原草送别》的这首五律时老诗人眼前一亮尤其是看到时顾老诗人就再也不能移开目光了他发现了年轻诗人敏锐的洞察力、深刻的领悟力和顽强的生命力老诗人已经被年轻诗人的才情所折服想起刚才所言老诗人发自肺腑说道：“能写出如此好诗的人要想在长安居住下来又有什么困难呢！老夫刚才的话只不过是玩笑话罢了！”
1069,论据是议论文中用来论点的材料论据包括和两种
1073,恨别鸟惊心（杜甫《春望》）
1075,《饮酒》中表明“结庐在人境而无车马喧”原因的诗句是
1077,结合以上三则材料分析我国快速发展的旅游业带来了哪些有益的影响？答
1078,杜甫在《春望》中写出了因战乱与家人难通音信对家人安危魂牵梦萦的诗句是
1079,古诗中有许多描写山高耸的诗句像杜甫在《望岳》中描写所见泰山的神奇秀丽和能分割日夜的巍峨形象的诗句是李白在《望天门山》中描写所见天门两山的雄姿的诗句是、
1080,《次北固山下》抒发了作者对时间飞逝新旧交替的感慨的诗句是
1082,下面句子应填入文中的处漕运发达时期“运河舟楫之盛可抵长城之雄”
1086,征蓬出汉塞（王维《使至塞上》）
1087,学校举行讲故事大会主题是“人生需要顽强的意志”某同学搜集了一组故事这组故事中不符合主题要求的两项是和1悬梁刺股2精卫填海3亡羊补牢4卧薪尝胆5愚公移山6班门弄斧
1095,微写作（1）从以下三个题目中年举了學按要求作答150字左右题目一：请从《红岩》《三国演义》这两部作品中任选一个人物以“你是这样的人”为开头写一段抒情文字要求:处填写人物姓名；富有文采题目二：《氓》中“淇水汤汤渐车帷裳”写女主人公被弃后渡淇水回娘家的情形面对淇水女子内心会有怎样的波澜请对她此时的心理进行描写要求:用第一人称;结合原文情节;想象合理题目三：近日2018年北京市中小学生科学建议奖出炉有10个优秀项目获奖学生们的建议话题涉猎广泛养老、共享停车、无障碍设施等都成为关注焦点作为北京城市副中心的一员请你就某一方面的思考积极建言献策要求:观点明确;理由充分
1098,同学们在整理资料过程中发现他们中的大多数容易将衣补旁（衤）和示补旁（礻）弄混同学们便查找资源总结规律根据所给的提示应在横线处应填写的一项是做偏方部首的字多与衣服有关如：衫、补、袖、表等字；做偏旁部首的字多与有关如：祠、祈、福、禁等字A建筑B心情C.祭祀D.天象
1101,中华民族文化源远流长习俗丰富多彩请仿照例句在传统的元宵、清明、端午、中秋、重阳、除夕等节日中选择两个进行仿写使仿写的两个句子与倒句组成排比句（注意节日的先后顺序）例句：春节贴对联放鞭炮寄寓生活红火吉祥如意；；
1102,在《次北固山下》一诗中既描绘了昼夜和冬春交替的景象又暗含自然理趣的句子是
1106,中华文明的沃土孕育出了一代代情系天下的人如：孔子、范仲淹、文天祥、林则徐除他们之外请你从积累过的古诗文里再举一例结合诗文简要说说作者情系天下的表现答
1109,悠悠岁月欲说当年好困惑亦真亦幻难取舍悲欢离合都曾经有过这样执着究竟是为了什么？”上世纪八十年代一部《渴望》一首《悠悠岁月》火遍全国人生路漫漫经历长久的磨练每个人都会感触良多经历了中考的洗礼有人欢喜有人忧请你给初中同学制作一张卡片附上一句古诗或名言表达对同学的劝勉之情
1111,在下面的横线上用正楷字将《次北固山下》补充完整次北固山下王湾客路青山外行舟绿水前潮平两岸阔风正一帆悬乡书何处达？归雁洛阳边峨眉山月歌李白峨眉山月半轮秋影入平羌江水流夜发清溪向三峡思君不见下渝州
1115,树木丛生（曹操《观沧海》）
1117,阅读小说最后两段从深入理解主题的角度提出问题并简要说明你提问的理由问题:理由
1121,下面两位同学读完《海底两万里》后创作的手抄报里面各涉及了小说中的一个故事请任选一个进行简要概述答
1124,2016年是长征胜利90周年北京市发布了19条红色旅游精品推介路线据此你的学校准备在假期组织同学参与“红色旅游活动”校团委想开展“红色旅游”宣传活动激发同学们的兴趣和热情团委委托你根据下面材料简要概括“红色旅游”的两个特点来向同学们介绍
1131,《陋室铭》中表现陋室主人交往之雅的是
1132,鲁人徙越鲁人身善织屦①（jù）妻善织缟②(ɡǎo)而欲徙③于越或④谓之曰：“子必穷矣”鲁人曰：“何也？”曰：“屦为履之也而越人跣行⑤；缟为冠⑥之也而越人被⑦(pī)发以子之所长游于不用之国欲使无穷其可得乎？”（节选自《韩非子·说林上》）[注释]①屦:古时用麻葛等织成的草鞋②缟:古代的一种白绢③徙：迁徙④或：有的人⑤跣行：跣行:赤脚走路跣赤脚⑥冠戴戴帽子⑦被发：披头散发被通“披”在“屦为履之也”这句中“屦”是“鞋”的意思但是“履”也是“鞋”的意思小明弄不懂了在这里“履”应该解释为
1137,在《愚公移山》中表现移山路途遥远的语句是
1138,阅读下面三则材料完成16-18题(共)近年来我国创造了无数的工程奇迹世界最长的高速铁路京广高速铁路、世界最长的跨海大桥港珠澳大桥、世界首个“智能码头”上海洋山港这些超城工程涉及交通、建筑等各个方年国家整面不论是科技含量还是技术水平都在世界范围内名列前茅体现了我国改革开放40年国家整体实力的巨大飞跃我国着力推动重大工程建设为经济发展、民生改善提供了强大保障在这些超级工程建设中超级装备发挥了巨大作用这些装备均由国家授入大量资金进行自主研发或工艺①或速度迅捷或功能完备它们不仅在我国建设中发挥着举足轻重的作用而且具有世界影响力目前千吨级以上的门式起重机（又称“龙门吊”）基本为中国所独有“中国天眼”是世界上迄今为止最大单口径最灵敏的射电望远镜……这些超级装备已经成为我国的“大国重器”以天安门为中心沿中轴线往南46公里外的大兴一座“风凰”造型的新机场航站楼初晨雄姿这就是被英国《卫报》评选为“新世界七大奇迹”之首的未来世界最大空港大兴国际机场新机场总投资约800亿元预计于2019年10月正式投入使用机场选地在北京、天津和雄安中间致力于满足京津冀协同发展的实际需求建成后将与原有的首都机场形成带动经济发展的“双引擎”②新机场站楼集成100多项技术创新中报专利27项机场的地下水东西两侧是城际铁路和高铁中间三条是机场专线和地铁五条线路站台区总宽度约270米相当于把整个北京火车站塞进航站楼里这在全球都堪称壮举为了减少地下轨道运行的震动对于航站楼的影响技术人员专门设计了横间的隔震技术航站楼的每个拉子在地上地下的交界处都垫了一层软软的橡胶垫这也使新机场威为全球最大的隔震建筑机场还搭建了成熟、稳定、可扩展的信息技术架构构建了旅客运行服务、综合文通管理、环境信息管理等九大业务平台实现全方位、全业务的智慧化管理盾构机即盾构隧道掘进机是一种隧道掘进的专用工程机械广泛用于地铁、铁路、公路、市政、水电等隧道工程随着世界各国城市、交通建设的发展市场需求不断上升而中国隧道施工曾一度依赖进口盾构机2001年盾构技术研究列入国家祕3计划项目由于国家重点扶持和企业的大力投资中国工程师攻克机械、电气、液压等技术难关通过自主创新掌握了隧道掘进机总体设计制造技术形成一批自主知识产权成果尤其是常压换刀、电液混合驱动等创新技术达到了国际领先水平累计获得专利授权1000多件c生产出成系列、多型号的产品远销欧洲、中东、东南亚地区满足了市场的多种需求为“一带一路”沿线的国家基础设施建设贡献了“中国动力”2012-2017年中国盾构机产量及盾构机进出口情况依据上下文在和的横线处依次填入的语句都正确的一项是A.①精巧②有效解决目前机场超负荷运行的问题B.①精湛②有效解决目前机场超负荷运行的问题C.①精湛②目前机场超负荷运行的问题得以有效解决D.①精巧②目前机场超负荷运行的问题得以有效解决
1139,阅读下面的文字完成22-25题①“我们都在努力奔跑我们都是追梦人”2019年习近平总书记新年贺词中一句亲切的话语成为了全国亿万追梦者的座右铭其实这已是总书记第六次发表新年贺词每一次的新年贺词都犹如温暖人心的新年序曲给全国人民以砥砺前行的强大力量“欲穷大地三千界须上高峰八百盘”展望2019年是新中国成立70周年是全面建成小康社会关键之年必须以坚如磐石的信心、只争朝夕的劲头、坚韧不拔的毅力继续前进因此②追梦路上当自强民族复兴伟大中国梦并非虚无缥缈的梦想无论从本世纪中叶实现建成中国特色社会主义现代化强国的宏伟蓝图还是从2020年全面建成小康社会或当下深化改革开放、打赢三大攻坚战来说都是有着实实在在的内容和非常清晰的目标目标就是方向有目标也才有动力正如习近平总书记所指出的：“梦想属于每一个人广大劳动群众要敢想敢干、敢于追梦”我们必须敢于追梦但“梦在前方路在脚下自胜者强自强者胜”①（只要只有）为着目标而努力坚定理想信念、勇于创新创造、矢志努力奋斗追梦才能成功③追梦路上当自强我们今天的中国梦是前所未有的伟大梦想追梦路上决不可能是一帆风顺而更多面临的是艰难曲折的考验去年以来在庆祝改革开放40周年大会等多次重要会议上习近平总书记反复强调只要精诚团结、共同奋斗就没有任何力量能够阻挡中国人民实现梦想的步伐！艰苦奋斗可以磨砺意志、坚定信念追梦路上我们最需要就是自信和勇气有自信和勇气就有力量就能排除万难勇往直前④追梦路上当自强梦想属于未来梦想是美好的②（因此然而）正如习近平总书记所讲“幸福不会从天降美好生活靠劳动创造”改革开放是干出来的中国特色社会主义新时代也是干出来的实现民族复兴伟大中国梦美好的未来也需要苦干实干和积极创造全面建成小康社会的奋斗目标为我们指明了光明的未来也赋予了每个追梦人以光荣的使命并提供了宝贵的机遇面对这样一个千帆竞发、百舸争流、有机会干事业、能干成事业的时代今天的我们必须要倍加珍惜、倍加努力③（只要只有）我们要拿出勇气、拿出干劲坚持奋斗就一定能够达到创造人民更加美好生活的宏伟目标！⑤“民生在勤勤则不匮”梦在路上路在脚下前进道路上有机遇也有挑战有困难更有希望把前无古人的伟大事业推向新高度贵在自强时不我待我们需要牢记的是习近平总书记一次次温暖而有力的激励只争朝夕在追梦路上自信自强接续奋斗奔向更加美好的未来结合上下文在第一段横线处补写一句话
1143,“诗词与欣赏”研究小组准备推送一段对诗歌的感悟阅读下面文字请帮助补上结尾句(句中须使用修辞或生动形象的词语)遇见一首好诗就像邂逅一束清澈的星光在心灵的礁岩处撞击出一蓬雪色的浪花感受到一枚金苹果落入意识的银网可见
1144,请根据原文填空周公吐哺其声呜呜然如怨如慕余音袅袅飞湍瀑流争喧豗不尽长江滚滚来
